News Title,Content
"Pune: 4,076 patients screened for swine flu | Pune News - Times of India","PUNE: As many as 4,076 patients presenting with influenza like illness were screened for swine flu at Pune Municipal Corporation (PMC) run screening centres in the city on December 4. With this, the total number of patients with influenza-like illness who were screened in the city so far this year has reached 9.83 lakh. ""Of the 9.83 lakh screened patients, we administered oseltamivir tablets popularly known as Tamiflu or Fluvir to a total 17,110 patients who were suspected to have contracted the infection,"" said a health official of Pune Municipal Corporation (PMC). As many as 173 patients have tested positive for the virus in the city so far this year. Of them, 54 have succumbed to the virus induced complication. Swine flu — just like any other flu — is a respiratory infection. It exploits a weakened immune system to attack major organs, especially lungs. When it gets into the lungs, it can lead to pneumonia, which can be fatal. The flu can also cause secondary infections to the body — any of which can lead to failure of vital organs and death. The symptoms of swine flu in people are similar to the symptoms of regular seasonal influenza and include fever, lethargy, lack of appetite and coughing. Some people with swine flu have also reported runny nose, sore throat, nausea, vomiting and diarrhoea. Taking medicine without consultation and delaying treatment can aggravate the condition. Experts say that people should continue to take precautions in terms of basic sanitation practices like frequent hand washing, good diet and healthy habits as the virus is still infecting people. People with co-morbid conditions should be more vigilant. Download The Times of India News App for Latest City News."
"With over 14,000 cases, Karnataka tops dengue list in the country | Bengaluru News - Times of India","BENGALURU: Over 35,079 cases of dengue have been reported from across the six states in south India till October this year, with the maximum number of them coming from Karnataka. According to information given by the government in Lok Sabha in reply to a question in Lok Sabha during the on-going session, Karnataka tops the list of the states that has reported the maximum number of cases in the country with 14,139 cases. The killer virus has been spreading its tentacles across the country with the six major south Indian states registering more than 50% of the cases. The mosquito-borne tropical disease has so far claimed 36 lives till October across the six states of South India including Karnataka, Tamil Nadu, Telangana, Andhra Pradesh and Kerala. The data has also revealed that the country has reported 91,457 cases of dengue till October. The western Indian states of Maharashtra and Goa have reported 9,899 and 908 cases respectively. The number could go up further after the figures for November and December are collated, officials said. Karnataka, which is better placed in terms of having better health facilities both in private and government sectors, has been witnessing a steep increase in dengue cases. The state had recorded 4,427 cases in 2018. Of the 14,139 cases reported this year, around 70 percent cases were reported in Bengaluru within the Bruhat Bengaluru Mahanagar Palike (BBMP) limits. Even majority of dengue deaths have reported from South. While 82 people have died due to dengue in the country in 10 months, 56 deaths have occurred in six states of south with Kerala reporting 16 deaths and Karnataka 13. So, why dengue is rising in South India? According to public health experts lack of public awareness and failure of authorities to contain the menance has led to the increase in mosquito breeding spots in the state. “The need is to create public awareness, which plays an important role in preventing mosquito breeding, said Pankaj Kumar Pandey, commissioner, health and family welfare department, Karnataka. The government has initiated a campaign in this regard. “The government has taken up massive IEC (information, education, communication) activities across the state with ASHA workers. The health workers will conduct house-house survey and distribute an educational material and a form to fill up. The head of household can fill the form that has queries on their understanding of mosquito control measures. We call this initiative ‘Nagarikarige Ondu Saval (A challenge to public), which has begun from November 1 and goes on till January 30, 2020,” he added. Some experts feel that the reporting pattern of dengue cases by the state also could be a reason for Karnataka outnumbering rest of the country in dengue. Only north India states which have reported high number of cases are Uttarakhand (9574 cases) and Gujarat (8,410). As many as 12 people have succumbed to dengue in Uttarakhand and eight in Gujarat. Interestingly, West Bengal, one of the highly populated states, has reported not even a single dengue case. Download The Times of India News App for Latest City News."
34 lions had died in canine distemper virus outbreak: Gujarat govt | Ahmedabad News - Times of India,"GANDHINAGAR: The state government on Tuesday raised the number of lion deaths in the disease outbreak of October 2018 — due to canine distemper, babesiosis, streptococcal bacteria and gram-negative bacilli — to 34 from the earlier figure of 29. To a question by Congress’s Khambhalia MLA Vikram Madam, the state government submitted a written reply in the assembly, said that 34 other infected lions had been caged and vaccinated. These were from Sarasia Virdi in the Dalkhaniya range.  “So far, the government was maintaining that 29 lions had died in the outbreak, but the government has now admitted the correct figure of 34,” a forest department official said, on condition of anonymity. The official said a recently published research paper by the Pune-based National Institute of Virology (NIV) had put the figure of infected lions at 68, which now matches with the numbers the state admitted. The paper was published in a newsletter of the US-based Center for Disease Control (CDC). The study revealed that canine distemper virus (CDV) and Babesia infections, which killed 34 lions in September-October 2018, was detected in a total of 68 lions and six leopards. NIV Pune tested samples from 316 lions and 52 leopards. “The government had so far concealed the fact that 34 lions that were caged were also infected with CDV and other infections, and that they had been vaccinated,” the official said. The official said the CDV-infected lions were kept in quarantine on the pretext of being kept for the breeding purposes. Wildlife experts said these vaccinations had cured these big cats but as their immunity levels have suffered and they can become carriers of the virus and be dangerous for other lions. “Therefore, in the first week of May, the state forest department decided to indefinitely extend their captivity,” the official said. The state government reply stated that Rs 10.68 crore was spent on controlling the outbreak. Lions from various forest ranges including Sarasia Virdi were kept under observation at rescue centres in Dhari and Jamwala, the government reply said. After the lion deaths, 140 teams with a total of 550 staffers carried out a survey over 3,200 sq km, looking for lions with symptoms of CDV and Babesia infection. Download The Times of India News App for Latest City News."
Ahmedabad: 42% of dengue patients are children | Ahmedabad News - Times of India,"AHMEDABAD: Parents beware. This year more than 42% of those detected with dengue infections were children below 15 years of age. If you have been careless at home when it comes to vector control or have generally overlooked your kid’s schools mosquito control precautions, you better take note. This year 4,195 dengue cases have been registered in the city, till November 30.  A detailed study of 6,434 dengue cases by Community Medicine Department of BJ Medical College, from 2010 to 2016, revealed that the dengue incidence was 16.3 per lakh population and the maximum incidence rate (26.2) was seen in children up to the age of 14 years, followed by 15-44 years where the incidence rate was 17.3 per lakh population. The study also revealed that the most common dengue virus serotype that was detected in the city was serotype-2, which happens to be a lethal dengue strain. The study was conducted to know the trend and epidemiological profile of dengue cases and deaths. Another startling fact revealed in the report was that nearly 58% of deaths registered between 2010 and 2016 were of children aged up to 14 years. A substantial increase in the dengue incidence was seen in the years 2015 and 2016. “Case fatality rate because of dengue was less than 1% while the proportion of deaths was maximum (57.89%) in children up to the age of 14 years,” the study states. This year, some 706 of the 4,000-odd dengue cases registered were that of children aged between 9 to 14 years. A senior official in the Ahmedabad Municipal Corporation (AMC) health department said, “In many cases we have found that schools have been careless with vector control measures and since children spend a lot of their time there, they are more likely to be bitten by Aedes aegypti mosquitos.” Download The Times of India News App for Latest City News."
"Swine flu: No isolation beds, separate queues in hospitals | Lucknow News - Times of India","LUCKNOW: The H1N1 virus has already infected 550 people in the city and claimed seven lives, but three major government-aided hospitals here are doing precious little to prevent the swine flu scourge. It becomes more important given the fact that December-February are most conducive for the spread of H1N1 virus. A TOI reality check on Friday exposed how blatantly safety protocol and guidelines of the World Health Organisation are being violated at a time the seasonal intensity of the disease is expected to increase. According to WHO, every hospital should have separate registration counters for suspected swine flu patients and isolation wards for confirmed H1N1 cases. Posters with dos and don’ts for visitors must be put up everywhere while OPD signs should guide patients to exclusive waiting areas. There is no separate registeration counter for swine flu patients at Balrampur HospitalKing George’s Medical UniversityIn the absence of separate registration counters, evaluation chambers and waiting areas for suspected swine flu patients in the OPD, they were freely mixing with other patients. While the trauma centre and medicine department have isolation wards for swine flu cases, no exclusive bed was found in the casualty ward where critical patients are brought first. Doctors said a patient was sent to the isolation wards after swine flu confirmation. However, since test results take two days to arrive, it leaves enough scope for other patients in the casualty ward to be infected. Chief medical superintendent of KGMU professor SN Shankhwar said signs and awareness posters would be installed in a week across the campus. “All suspected cases will be directly transferred to isolation wards,” he added. Civil HospitalThe hospital neither has exclusive queues and waiting areas nor did TOI spot any awareness poster anywhere on the premises. To top it all, there is no isolation ward. Director of hospital Dr DS Negi promised to make all “required facilities available soon”, but didn’t specify how soon. Balrampur HospitalSuspected swine flu patients were seen coughing and sneezing without masks/handkerchiefs in common registration queues and waiting areas at the OPD. The hospital though has isolation wards in the emergency (one bed) and medicine (18 beds) wings while signs have also been placed. Spokesperson SM Tripathi said, “Separate queues/counters for suspected flu patients will be arranged soon and awareness posters too will be put up.”. Download The Times of India News App for Latest City News."
How swine flu virus has free run at OPDs in Lucknow | Lucknow News - Times of India,"LUCKNOW: While the H1N1 virus is stalking the state capital with a seasonal incidence rate of more than three patients a day, swine flu prevention protocol is conspicuous by its absence at two super speciality hospitals in the city. A TOI reality check has revealed that Ram Manohar Lohia Institute of Medical Sciences (RMLIMS) and Sanjay Gandhi Postgraduate Institute of Medical Sciences (SGPGIMS) largely ignore guidelines set by the World Health Organisation despite Lucknow witnessing 550 cases in less than six months (January-March, October-December) and seven deaths till date. TimesViewPrevention is better than cure. SGPGI and Ram Manohar Lohia Institute of Medical Sciences are top institutes of UP and must lead by example by following the preventive parametres prescribed by WHO. In fact, SGPGI gets suspected swine flu cases from across UP for confirmatory test. The flow of confirmed HINI influenza patients coming to SGPGI for treatment is also highest in comparison to other hospitals and medical institutes in the stat e. Precautionary measures would not only prevent spread of this highly contagious disease, but also reduce the burden of treatment. Similarly, RMLIMS can contribute in prevention and save valuable lives.An earlier survey had exposed similar healthcare anomalies at King George’s Medical University (KGMU), Balrampur Hospital and SPM Civil Hospital. SGPGIMSThe state health department recognises as valid swine flu tests done only at two government hospitals and SGPGI is one of them. While KGMU is the other recognised institution, the maximum number of cases so far this year have been treated in SGPGI. Despite this significant place in healthcare hierarchy, the hospital OPD has no separate registration counter or isolated waiting lounge for suspected patients of swine flu, an air-borne viral disease that spreads through coughing, sneezing, shaking hands or touching contaminated surfaces. Awareness posters to promote wearing of masks, among other things, are missing as are signs to guide patients to diagnostic labs. At the old OPD building, a grimy poster with the message that swine flu test is conducted ‘here’ was found outside a room, but enquiry revealed that the facility had been shifted elsewhere. The only face-saver for SGPGI is an 11-bed exclusive ward for swine flu patients. “After registration, patients with flu-like symptoms are first sent to the pulmonary OPD and then to the lab. Those who test positive are admitted to the isolation ward. Since the report takes 48 hours, a suspected patient can infect many others during that gap in the absence of safety protocol,” said an OPD visitor. RML hospitalLike SGPGI, this hospital too disregards WHO recommendations to stall a swine flu outbreak. RML hospital may have a six-bed isolation ward, but the OPD is a virus cauldron where suspected patients freely mix with others. RMLIMS director AK Tripathi, who is also officiating director of SGPGI at present, promised to plug the loopholes ASAP. “I will direct chief medical superintendent of both institutes to follow standard guidelines of WHO without delay,” he said. Download The Times of India News App for Latest City News."
Nipah virus alert sounded in Tripura | Agartala News - Times of India,"AGARTALA: Tripura government on Tuesday sounded an alert after the death of five members of a family in Nipah virus attack in a Bangladesh village bordering West Bengal, an official said here. The Tripura government issued a notice to all district chief medical officers to stay alert and remain vigilant about any impending Nipah virus attack in the state. The alert was sounded to all district chief medical officers, Joint Director of Family Welfare and Preventive Medicine, Dr. P Chatterjee said. Five persons of a family died in Bangladesh due to Nipah virus attack. The deaths occurred near the West Bengal border, not the international border adjoining Tripura. Since the incident occurred in Bangladesh, the Centre has asked us to stay alert, the official said. Nipah virus usually transmits from infected bats which carry the virus. Download The Times of India News App for Latest City News."
Kerala: Crow samples tested negative for West Nile virus | Kozhikode News - Times of India,"MALAPPURAM: The results of samples of crows collected from Kannamangalam region in the district have been tested negative for the West Nile virus. It was on Thursday when the animal disease control authorities received the results of four samples of crows which were collected from Kannamangalam where a fresh case of West Nile fever infection was reported last month. As the birds are natural hosts of the dreaded West Nile Virus (WNV), the animal husbandry authorities had collected samples of crows from the region on June 10. The report says that the brain, kidney, liver and heart samples of crows collected from the region have been tested negative. After West Nile fever was reported in March, five samples of crows were collected from Thennala region of the district which is adjacent region of AR Nagar panchayat where a 6- year-old boy had died of the infection. But the results of the samples collected were also turned out to be negative. The chief veterinary officer of Malappuram Dr Baby Joseph said that the negative results of samples of birds show that the chances of spread of the disease in the region through birds are very less.   Download The Times of India News App for Latest City News."
Lucknow's dengue tally up by 14 cases | Lucknow News - Times of India,"LUCKNOW: With 14 new dengue cases being reported on Friday, Lucknow's tally rose up to 1,519 since January and 1,504 since July. Of the new cases, three patients - one woman and two men -were admitted to King George's Medical University and a private hospital on Raebareli Road. Meanwhile, larvae of Aedes aegypti - the carrier of dengue virus - were spotted in eight houses on Friday. The health department officials inspected 1,805 homes in three localities. Download The Times of India News App for Latest City News."
"Mumbai: Of 393 HIV+ moms, only two babies contract virus | Mumbai News - Times of India","MUMBAI: Only two of the babies born to 393 HIV-positive mothers in Mumbai tested positive for the virus in 2018-19, indicating the city’s HIV-care programme has been effective in checking mother-tochild transmission of the virus. As HIV-positive mothers can transmit the virus to their newborn during pregnancy, childbirth or breastfeeding, National AIDS Control Organisation (NACO) started giving to-be mothers a three-drug regimen few years back to reduce the risk of transmission. Earlier regimens were not as effective in controlling transmission. In 2013, it was estimated that India had 1,45,000 HIVpositive children. But data of the last five years from Mumbai AIDS Control District Society (MDACS) shows a steady decrease in newborns who test positive for the virus at the end of 18 months. The PPTCT programme enrolled 517 HIV-positive pregnant women in 2014-15; 17 of the babies were found reactive for HIV at the end of 18 months of age. While the transmission percentage then was 3.2%, it reduced to 0.5% in 2018-19. “Our aim is to start HIV-positive mothers-to-be on the new multidrug regimen as soon as possible. Earlier in the pregnancy that they get the drugs, lower the risk of transmission,’’ said Dr Sreekala Acharya of MDACS. World Health Organization defines elimination of mother-tochild HIV transmission as one per one lakh deliveries. Considering that 1.5 lakh deliveries take place in Mumbai every year, doctors feel Mumbai is on the verge of achieving the target. Data from BMC’s hi-tech molecular diagnostic laboratory at Kasturba Infectious Diseases Hospital, near Saat Raasta, shows that positivity among children born to HIV-positive mothers is decreasing across the state. The lab gets samples for conducting DNA tests on dried blood spot samples from children born to HIV-positive mothers; the children are testeds at six weeks and 18 months of age. Between 2010-15, the laboratory tested 1,808 dried samples from children born to HIV-positive mothers and found 214 children were HIV-positive. There is a drop in the corresponding number after NACO’s new drug regimen: Of 1,410 samples tested between 2015-19, only 102 tested positive for HIV. Studies from centres across the country showed reduced transmission rates. A senior NACO official said the organization is still collating figures on this intervention. “But, yes, the mother-to-child transmission rate is dropping as expected,’’ the official added. Download The Times of India News App for Latest City News."
"Nipah scare: Union health minister Harsh Vardhan reviews public health measures, says situation under control | Kochi News - Times of India","NEW DELHI: Union health minister Harsh Vardhan, who reviewed the public health measures put in place in Kerala after a college student tested positive for Nipah virus, on Wednesday said the situation is under control and people need not panic. The 21-year-old college student's case is this year's first in Kerala. Last year, the Nipah virus killed 17 people in the state. ""I urge the people not to panic as the government is leaving no stone unturned to remedy the situation. I am personally reviewing the situation with Health Minister of Kerala, K K Shailaja, on a regular basis,"" Vardhan said. The key focus of Wednesday's review meeting was updating of contact list (line listing with contact details), daily follow-up for symptoms and self-monitoring, the health ministry said in a statement. The team also discussed SOPs for quarantine of symptomatic contacts, sample collection or testing and dedicated isolation facility with trained health staff for the care of cases and epidemiological investigation by the multi-disciplinary central team to ascertain the possible source of infection and history of exposure. The Centre had on Tuesday rushed a six-member team comprising an epidemiologist to Kerala to conduct contact tracing for early detection of suspects and review of isolation facilities. The team also stressed on the need for proper record-keeping in the district control room with daily sharing of information, the statement stated. A designated control room has been established at the district collector's office and an isolation ward has been established at Government Medical College Ernakulam, the statement said. Isolation facilities have also been ensured at Medical Colleges at Calicut, Thrissur and Kottayam, it said. All healthcare facilities have been asked to ensure a high index of suspicion in cases with similar symptoms and also ensure availability of isolation and emergency management facilities before referral, the ministry said. The statement said that the condition of the college student, a resident of Paravur, is now stable and a total of 314 contacts are being followed up on a daily basis. Five symptomatic contacts have been admitted in the quarantine facility at the medical college and samples have been sent for testing, it said. According to the statement, the student got a fever on May 23 when he was in district Thrissur. He visited a physician there but returned to his family in Ernakulum as he had a high fever. ""He consulted a private hospital in Ernakulam on May 25 and was treated with antibiotics. He was referred to another private hospital on the night of May 30 as he developed slight disorientation and gait imbalance,"" it said. ""Throat swab, CSF blood and urine samples were sent to the National Institute of Virology Alapuzha on June 2 which tested Nipah positive. The patient is stable, conscious and oriented at present. All three other family members are healthy,"" it added. According to the World Health Organisation (WHO), Nipah virus is a newly emerging disease that can be transmitted from its reservoir (natural wildlife host), the flying foxes (fruit bats), to both animals and humans. It takes its name from Sungai Nipah, a village in Malaysia where it was first identified. Symptoms range from asymptomatic infection, acute respiratory infection (mild, severe), and fatal encephalitis. Infected people initially develop influenza-like symptoms of fever, headache, myalgia, vomiting and sore throat. This can be followed by dizziness, drowsiness, altered consciousness, and neurological signs that indicate acute encephalitis. Some people can also experience typical pneumonia and severe respiratory problems, including acute respiratory distress. Encephalitis and seizures occur in severe cases, progressing to coma within 24 to 48 hours. Download The Times of India News App for Latest City News."
