News Title,Content
"BJP holds protest rally, says ‘JNU virus’ entered Rajgarh | Bhopal News - Times of India","Bhopal: BJP on Wednesday held a massive protest in Rajgarh with the demand to register FIR against the district collector and officials involved in alleged assault of party workers during a pro-CAA rally on Sunday. The party leaders said the incident shows that ‘Jawaharlal Nehru University virus’ has also entered the district. “I have heard that ‘JNU virus’ has also entered Rajgarh. I came to know that the district collector Nidhi Nivedita has studied in JNU. The public of Rajgarh better knows how to eliminate the virus,” said BJP national general secretary Kailash Vijayavargiya, during the protest rally in Rajgarh-Biaora town. Comparing Sunday’s incident with the JNU protests, the BJP leader further said, “In JNU, the students raise anti-national slogans and also often insult the Tricolour there. Here too, our workers carrying Tricolour were humiliated by government officials, which is a sign of the JNU culture.” BJP had announced to launch an agitation against the Congress government over the Rajgarh incident in which two senior women officials took on some unruly protesters, allegedly for misbehaving with them while trying to take out a pro-CAA rally by defying prohibitory orders under Section 144. In video clips of the Sunday’s incident, Nivedita can be purportedly seen slapping a man and the deputy collector taking on some men who were part of the rally in Biaora. BJP leaders said that they will move court if a case is not registered against Nivedita. The party had also sent a fact-finding team on Monday to assess the cause of the incident. Later, party top leaders decided to reach Rajgarh to register FIR against the officials involved in the assault of its workers. On Wednesday afternoon, BJP state president Rakesh Singh, former chief minister Shivraj Singh Chouhan, Vijayavargiya and Leader of Opposition (LoP) Gopal Bhargava reached Rajgarh to ensure that an FIR be registered against Nivedita and other officials. They also held a vehicle rally, with top leaders greeting people on a truck and addressed a huge public gathering. Making a scathing attack on the Congress-led Kamal Nath government, former CM Chouhan said that BJP workers will not remain silent. “The officials who had assaulted our workers will face consequences”, he said. “Who gave you (collector) permission to beat (BJP) workers who were peacefully demonstrating with Tricolours in their hands? Don’t be egoistic, else your ego will be crushed. In which law is it written that a person carrying the Indian flag should be beaten up? This would be the last nail in the coffin of the Kamal Nath government,” said Chouhan. The former CM further hit out at the Congress government and said, “Listen Kamal Nath! We will burn your Lanka to ashes. BJP workers do not tease anyone, but when someone teases us, we do not spare them. Never take BJP workers lightly, otherwise you (Congress) will have to pay a very heavy price,” said an agitated Chouhan. Chouhan also said that if cops refuse to take complaint against the administrative officials, the BJP leaders would reach the police station to lodge the FIR. After his threat, police officers reached the stage and took the complaint against the collector and deputy collector. Rakesh Singh and LoP Bhargava also called upon the workers to continue with their awareness campaign in support of the CAA. Singh said that BJP workers will hit the road and the struggle against the Congress government in Madhya Pradesh will continue. Download The Times of India News App for Latest City News."
"Germany, Japan confirm human-to-human transmission of virus - Times of India","NEW YORK: Health officials on Tuesday reported what appear to be the first known cases of human-to-human transmission of the virus in Germany and in Japan. Another case was recently reported in Vietnam. The cases show that countries across the world are now faced with the task of limiting the spread of the disease on their own soil, not just seeking to identify and quarantine ailing patients who had travelled from China. Japan’s ministry of health, labour and welfare said the first Japanese national — and the sixth person in Japan overall — to be diagnosed with the coronavirus was a man in his 60s. He had never been to Wuhan, but he had worked as a bus driver earlier this month for two different group tours from that city, officials said. The man began experiencing symptoms on January 14 and was confirmed to have the coronavirus on Tuesday. The infected German, whose case was also confirmed on Tuesday, is a 33-yearold man from Bavaria who had been in contact with a Chinese woman in Germany, officials said. The woman was diagnosed with the virus after flying home to China. The man was in good condition, German officials said. “It was to be expected that the virus would come to Germany,” Jens Spahn, Germany’s health minister, said in a statement on Tuesday. The WHO said on Friday that there appeared to have been a case of human-to-human transmission in Vietnam. The person had never been to China, but had a relative who had visited Wuhan, and was confirmed to have the virus. Download The Times of India News App for Latest World News."
" 43 flights, over 9000 passengers screened for novel coronavirus, no cases found: Health secretary | India News - Times of India","NEW DELHI: A total of 43 flights and 9,156 passengers were screened for novel coronavirus till Tuesday at the seven identified airports including Delhi, Mumbai, Chennai and Kolkata, Union Health Secretary Preeti Sudan said on Wednesday. Till now, no cases have been detected through these screening efforts, she said. Sudan further said the Indian Embassy in China has been regularly providing the health ministry with updates on the status of the infected cases in that country. The Embassy has informed that a total of 440 cases of pneumonia with novel coronavirus were confirmed in China and nine people have died till Wednesday. ""Cases have been reported in 14 provinces (including Taiwan) and municiplalities as well,"" the health secretary told PTI. Download The Times of India News App for Latest India News."
Xi says China fighting 'demon' virus as nations prepare airlifts - Times of India,"WUHAN: China is battling a ""demon"" virus that has so far killed more than 100 people, President Xi Jinping said Tuesday, as nations readied planes to airlift foreigners trapped at the epicentre of the outbreak. Xi made his remarks during talks with the head of the World Health Organization in Beijing amid growing global concerns about a novel coronavirus that has infected thousands in China and reached more than a dozen other countries. In a development that could cause more jitters abroad, Japan and Germany reported the first confirmed cases of human-to-human transmission outside of China. The infection is believed to have originated in a wild animal market in the central Chinese city of Wuhan, where it jumped to humans before spreading rapidly across the country, prompting authorities to enact drastic nationwide travel restrictions in recent days. Countries are also concerned about the fate of thousands of foreigners stuck in Wuhan, a city of 11 million people that has been sealed off by Chinese authorities in a bid to contain the disease. Tokyo deployed a plane to the virus-stricken metropolis late Tuesday that was scheduled to repatriate Japanese nationals on Wednesday, the same day that a US aircraft is expected to bring American citizens back to their homeland. France and South Korea are also planning to fly out their citizens later this week, and several other countries, including Germany, were considering doing the same. ""Chinese people are currently engaged in a serious struggle against an epidemic of a new type of coronavirus infection,"" Xi told WHO chief Tedros Adhanom Ghebreyesus. ""The epidemic is a demon, and we cannot let this demon hide,"" the Chinese leader said, pledging that the government would be transparent and release information in a ""timely"" manner. His comments came after anger simmered on Chinese social media over the handling of the health emergency by local officials in central Hubei province. Some experts have praised Beijing for being more reactive and open about this crisis as compared to its handling of the Severe Acute Respiratory Syndrome (SARS) epidemic of 2002-2003. But others say local cadres were more focused on projecting stability earlier in January than adequately responding to the outbreak during regional political meetings. Since then, the number of cases has soared -- doubling to more than 4,500 in the past 24 hours. The WHO last week stopped short of declaring the outbreak a global emergency, which could have prompted a more aggressive international response such as travel restrictions. Until Tuesday, all reported cases in more than a dozen countries had involved people who had been in or around Wuhan. But in Japan, a man in his 60s apparently contracted the virus after driving two groups of tourists from the city earlier in January, the health ministry said. And a 33-year-old German man contracted the disease from a Chinese colleague from Shanghai who visited Germany last week, according to health officials. Vietnam has been investigating a possible case of human-to-human transmission. The development came after countries including Sri Lanka, Malaysia and the Philippines announced tighter visa restrictions for people coming from China. China has taken its own drastic steps to stop the virus, which health officials say is passed on between people through sneezing or coughing, and possibly through physical contact. Zhong Nanshan, a renowned scientist at China's National Health Commission, told the official Xinhua news agency on Tuesday that the outbreak could peak in a week or 10 days. Authorities initially sealed off Wuhan and other cities in Hubei province late last week, trapping more than 50 million people. China has since extended the Lunar New Year holiday to keep people indoors as much as possible, and suspended a wide range of train services. On Tuesday, authorities urged Chinese citizens to delay any foreign travel ""to protect the health and safety of Chinese and foreign people"". Wuhan, meanwhile, has been turned into a near ghost-town under a lockdown that has largely confined the industrial hub's residents to their homes. With a ban on car traffic, the streets were nearly deserted apart from the occasional ambulance -- although the city's hospitals are overwhelmed. ""Everyone goes out wearing masks and they are worried about the infection,"" said David, a Chinese man who works in Shanghai but ended up trapped in Wuhan after it was put under quarantine. Download The Times of India News App for Latest World News."
WHO chief says China virus evacuations not recommended: Report - Times of India,"BEIJING: The World Health Organisation ""does not recommend the evacuation"" of foreign nationals from China's virus-hit Hubei province, the chief of the UN health body, Tedros Adhanom Ghebreyesus, said on Tuesday as he called on the international community to remain calm. His remarks during his meeting with Chinese foreign minister Wang Yi came as India, US and several other countries are finalising plans to evacuate their citizens from Hubei province, the epicentre of the virus outbreak. Over 250 Indians, mostly students, research scholars and professionals are working in Indian and international companies in Hubei province for which Wuhan is the capital where the deadly coronavirus first emerged last month. China on Tuesday reported 24 more deaths from coronavirus epidemic, taking the number of fatalities to 106 as the confirmed cases of pneumonia caused by the outbreak stand at 4,515. Crucially from China's point of view, Ghebreyesus said the WHO ""does not recommend the evacuation of nationals, and called on the international community to remain calm and not overreact,"" according to state-run Xinhua news agency. Thousands of foreign nationals from Pakistan, Sri Lanka, Bangladesh besides large number of people from African countries were reportedly held up in the virus-hit province. China has already permitted to evacuate US and various other countries which had Consulates in Wuhan. Ghebreyesus, who is visiting Beijing for talks with Chinese officials on the crisis, appreciated China's efforts in curbing the spread of pneumonia. During his meeting with Wang, Ghebreyesus said the WHO and the international community speak highly of and fully affirm the decisive measures the Chinese government has taken, Xinhua reported. ""The WHO is confident in China's epidemic prevention and control ability,"" he said. After the virus outbreak, China identified the pathogens in record time, shared the genetic sequence of the novel coronavirus with the WHO and other nations, and carried out a series of effective measures to curb the spread of the virus, he said, adding that the power of China's system and the effectiveness of its measures are ""rarely seen in the world"" and are ""admirable."" He said the WHO hopes to strengthen cooperation with China and is willing to provide all necessary help. Wang said China ""appreciates the WHO's objective and just stance and its full recognition to China's anti-virus measures"". ""Your visit to China not only shows your support for China but also injects impetus into China's cooperation with the WHO,"" said Wang. ""We have full capability, confidence and resources to overcome the epidemic at an early date,"" Wang said. China is willing to continuously deepen cooperation with the international community, especially the WHO, in an open and transparent manner to contribute to global public health, Wang said. In New Delhi, Chinese Ambassador Sun Weidong also said the WHO ""does not recommend the evacuation of nationals, and called on the international community to remain calm and not overreact."" ""The WHO is confident in China's epidemic prevention and control ability,"" Sun tweeted. On Sunday, the WHO admitted an error in its assessment of the global risk of a deadly virus in China, saying it was ""high"" and not ""moderate"", reports said. The Geneva-based health body said in its latest situation report that the risk was ""very high in China, high at the regional level and high at the global level."" Ahead of his visit to China, Ghebreyesus said on Thursday that ""this is an emergency in China, but it has not yet become a global health emergency."" Download The Times of India News App for Latest World News."
"China virus spreads to US, Taiwan; claims sixth victim - Times of India","An outbreak of a viral lung illnesses in central China has spread more widely across the Asian nation, sickening several hundred, and global health officials are attempting to contain an illness that has crossed borders to five countries, including the US. Six deaths have been reported and cases have been found five other countries. US Centers for Disease Control and Prevention officials said on Tuesday that a case had been identified in Washington state from a person recently travelling in China. Since the new coronavirus was first detected in December in China’s Wuhan province, the number of infections from the has grown to 291, with 139 of them over the past weekend. While the vast majority of the cases are in Wuhan, a city of 11 million in the eastern inland of China, infections have been reported in Beijing, Shanghai, Tianjin, Zhejiang and Henan. Four cases have been confirmed overseas among Chinese travellers in South Korea, Japan and Thailand. A Taiwanese businesswoman who just returned from Wuhan tested positive for the virus, Taiwan’s Centers for Disease Control reported on Tuesday. Health officials still don’t know how dangerous the virus is or exactly how it spreads, but the rapid rise in illnesses has prompted tightened borders and a rapid attempt to trace contacts of those who have become ill. On Wednesday, the World Health Organization is scheduled to debate whether to declare the situation a public health emergency of international concern, a designation used for complex epidemics that can cross borders. Russia has tightened border controls with China, and the US has set up airport checkpoints for passengers coming from China. On Tuesday, the US said that it had added new checkpoints in Atlanta and Chicago, in addition to New York, San Francisco and Los Angeles. Some new cases have involved doctors and nurses, a sign that the virus is being transmitted from person to person. The infection, which can cause pneumonia in patients, has evoked comparisons to SARS. SARS, or severe acute respiratory syndrome, originated in China and spread through airports and hospitals around the globe in a matter of months in the early 2000s. While it isn’t clear how the Wuhan virus compares to SARS in strength or transmissibility, with the Chinese New Year travel season about to send billions of people on holiday journeys, no one wants to take a chance. A WHO emergency declaration could include recommendations to restrict travel or trade to stop the outbreak. The agency has formed teams at its Geneva headquarters to study the virus, its spread and its symptoms and is sending a team to China to help gather information, according to David Heymann, an infectious disease researcher in the UK who advises the agency. Download The Times of India News App for Latest World News."
On the menu at China virus market: Rats and live wolf pups - Times of India,"SHANGHAI: The food market where China's deadly virus surfaced was a smorgasbord of exotic wildlife ranging from wolf pups to species linked to previous pandemics such as civets, according to vendor information and a Chinese media report. The Huanan Seafood Market in the central city of Wuhan came under greater scrutiny on Wednesday as Chinese officials said that the virus which has so far killed nine people and infected hundreds may have originated in a wild animal sold at the food emporium. Past deadly epidemics have been blamed on wild animals — Severe Acute Respiratory Syndrome (SARS) was linked to Chinese consumption of civet meat — setting Chinese authorities up for potential embarrassment if lax supervision of wildlife trafficking is found at fault in the latest outbreak. A price list circulating on China's internet for a business at the Wuhan market lists a menagerie of animals or animal-based products including live foxes, crocodiles, wolf puppies, giant salamanders, snakes, rats, peacocks, porcupines, camel meat and other game — 112 items in all. ""Freshly slaughtered, frozen and delivered to your door,"" said the price list for the vendor, ""Wild Game Animal Husbandry for the Masses"". Gao Fu, director of the Chinese centre for disease control and prevention, said in Beijing on Wednesday that authorities believe the virus likely came from ""wild animals at the seafood market"" though the exact source remains undetermined. China bans the trafficking of a number of wild species or requires special licenses, but regulations are loose for some species if they are commercially farmed. AFP was unable to directly confirm the authenticity of the price list. Phone calls to the vendor went unanswered, and attempts to connect to its social media accounts were rejected. The Beijing News published a photo Tuesday showing the same vendor's now-shuttered store front, as authorities in white hazmat suits milled about. The paper also quoted other merchants as saying trade in wildlife took place up until the market was shuttered for disinfection shortly after the outbreak. A number of the early sufferers of the virus, now known as the 2019 Novel Coronavirus (2019-nCoV), were employees of the market. Many exotic species are still widely consumed in China or other Asian countries where they are considered a delicacy — like the civet or some rats or bats — or for purported health benefits that are unproven by science. But this brings growing human health risks, said Christian Walzer, executive director of the US-based Wildlife Conservation Society's Health Program. Walzer said 70 percent of all new infectious diseases come from wildlife, with habitat encroachment increasing the chances of pathogens spreading. ""Wildlife markets offer a unique opportunity for viruses to spill over from wildlife hosts,"" he said. ""It is essential to invest resources not only into discovering new viruses, but more importantly, in determining the epidemiological drivers of... (the) spillover, amplification, and spread of infectious diseases."" Bats are thought to have spawned SARS, which in 2002-03 killed hundreds of people in Asia, mostly China. SARS was also found in civets in wildlife markets in China, with many scientists believing the bat virus infected the cat-like creatures and then humans who ate them. Following SARS, China cracked down on consumption of civets and some other species, but conservationists say the trade continues. China has so far won praise for its openness and handling of the current outbreak in stark contrast to SARS, when it was accused of stifling information and failing to cooperate with the rest of the world. Download The Times of India News App for Latest World News."
China fighting 'demon' virus as contagion spreads abroad: Xi Jinping - Times of India,"WUHAN: President Xi Jinping said on Tuesday that China was in a struggle against a ""demon"" epidemic, as the death toll from the new SARS-like virus soared to 106 and the first cases of human-to-human contagion were detected abroad. Xi made his remarks during talks with head of the World Health Organization in Beijing as a host of nations prepared to airlift their citizens from Wuhan, the epicentre of the outbreak. ""Chinese people are currently engaged in a serious struggle against an epidemic of a new type of coronavirus infection,"" Xi told WHO chief Tedros Adhanom Ghebreyesus. ""The epidemic is a demon, and we cannot let this demon hide,"" the Chinese leader said, pledging that the government would be transparent and release information on the virus in a ""timely"" manner. His comments came after anger simmered on Chinese social media over the handling of the health emergency by local officials in central Hubei province, where the disease first emerged in December. Some experts have praised Beijing for being more reactive and open about this virus compared to its handling of the Severe Acute Respiratory Syndrome (SARS) epidemic of 2002-2003. But others say local cadres had earlier been more focused on projecting stability than responding to the outbreak when it began to spread earlier this month. Since then, the number of cases has soared -- doubling to more than 4,500 in the past 24 hours. WHO chief Tedros praised China's response to the crisis during a meeting with Foreign Minister Wang Yi, according to state news agency Xinhua. The WHO last week stopped short of declaring the outbreak a global emergency, which could have prompted a more aggressive international response such as travel restrictions. But global concern has been growing, with Japan and Germany on Tuesday reporting the first human-to-human infections outside China. Until now, all cases in more than a dozen countries involved people who had been in or around Wuhan. In Japan, a man in his sixties contracted the virus apparently after driving two groups of tourists from the city earlier in January, the health ministry said. He was hospitalised with flu-like symptoms on Saturday. On the other side of the world, a 33-year-old German man caught the disease off a Chinese colleague from Shanghai who visited Germany last week, according to health officials. The development came after countries including Sri Lanka, Malaysia and the Philippines announced tighter visa restrictions for people coming from China. Experts believe the virus came from a wild animal market in Wuhan and then jumped to humans, with Chinese health officials saying on Tuesday that people infect each other through sneezing or coughing, and possibly through contact. Authorities initially sealed off Wuhan and other cities in Hubei province late last week, trapping more than 50 million people. China then halted international and domestic group tours. It also imposed a wide range of travel restrictions inside China, suspending long-distance bus routes and more than 2,000 train services. But with the death toll climbing and more fatalities reported in Chinese cities far away from Wuhan, authorities on Tuesday urged people to delay any foreign travel ""to protect the health and safety of Chinese and foreign people"", the National Immigration Administration said. Wuhan, meanwhile, has been turned into a near ghost-town under a lockdown that has largely confined the industrial hub's 11 million people to their homes. With a ban on car traffic, the streets were nearly deserted apart from the occasional ambulance -- although the city's hospitals are overwhelmed. Download The Times of India News App for Latest World News."
