News Title,Content
Thousands held in cruise ship in Italy over feared coronavirus cases - Times of India,"CIVITAVECCHIA: More than 6,000 tourists were under lockdown aboard a cruise ship at an Italian port on Thursday after two Chinese passengers were isolated over fears they could be carrying the coronavirus. Samples from the two passengers were sent for testing after three doctors and a nurse boarded the Costa Crociere ship in the port of Civitavecchia to tend to a woman running a fever, the local health authorities said. Costa Crociere confirmed the ship, carrying some 7,000 people in total including the crew, was in lockdown. It came as China reported its biggest single-day jump in coronavirus deaths and global fears deepened over a spread of the disease, with at least 15 countries confirming infections. Costa said a 54-year old woman from Macau ""was placed in solitary confinement in the on-board hospital last night with her travel companion"", and the crew was following instructions from the health ministry. The Costa Smeralda, the company's flagship and the fifth-largest cruise ship in the world, ""came from Palma de Mallorca and is currently engaged in one-week cruises in the western Mediterranean,"" it said. Italy's Prime Minister Giuseppe Conte said the government was ""not worried, but vigilant and cautious"". The couple flew in to Milan from Hong Kong on January 25, before getting on the cruise at Savona in northern Italy, according to Italian media reports. ""The couple's cabin has been isolated and they are in with the doctors,"" an unnamed passenger was quoted as telling ANSA news agency. ""We're a bit worried of course. No-one is getting on or off the ship apart from the doctors. This holiday risks ending in a nightmare"". The ship then stopped off in Marseilles and Barcelona, as well as Parma de Mallorca, according to an itinerary on its website. It had been due to sail for La Spezia in north Italy late Thursday, but would be detained in the Civitavecchia port near Rome ""until we have an update on the health tests,"" said port captain Vincenzo Leone. There are some 750 other Chinese passengers on board, who all appear to be in good health, media reports said. The World Health Organization, which initially downplayed a disease that has now killed 170 in China, was preparing to meet Thursday to decide whether to declare it a global emergency. Silvio Brusaferro, president of the Italian national health institute, said that all suspected cases in Italy so far had turned out to be false alarms, but the health service was ""ready should any cases of infection emerge"". Beijing has taken extraordinary steps to arrest the spread of the virus, including effectively quarantining more than 50 million people in Wuhan and surrounding Hubei province. The pathogen is believed to have emerged in a market that sold wild game, and spread by a Lunar New Year holiday season in which hundreds of millions of Chinese travel domestically or abroad. Download The Times of India News App for Latest World News."
"Europe evacuation flight off to China, cruise ship checked - Times of India","LISBON (PORTUGAL): An A380 passenger plane left Portugal on Thursday en route to pick up hundreds of Europeans in China who want to escape the new virus and Italian authorities were keeping some 6,000 passengers on a cruise ship while they checked for a possible infection. The plane took off from a former military airport at Beja, 200 kilometers (120 miles) southeast of Lisbon carrying just its pilots and crew. Captain Antonios Efthymiou said the flight would go first to Paris, where it would pick up a team of doctors and extra crew, before heading to Hanoi and then China. He told Portuguese media it would bring back about 350 Europeans. Efthymiou described the flight as ""a humanitarian mission."" He said the crew would take special medical precautions, but he did not elaborate. Portuguese Foreign Minister Augusto Santos Silva said the flight was coordinated between European Union countries and Chinese authorities. As concerns about the cornonavirus outbreak rippled across the world, two more European airlines halted services to China and a major European company shuttered its China stores. China has reported 170 deaths from the virus and at least 7,700 infections. More people have now been infected by this coronavirus in China than were sickened there during the 2002-2003 SARS outbreak. In Europe, there have been 10 confirmed cases of the virus: five in France, four in Germany and one in Finland. Italian health authorities, meanwhile, were screening passengers aboard a cruise ship docked north of Rome after a passenger from Macao came down with flu-like symptoms, officials said Thursday. The Costa Crociere cruise line said the 54-year-old woman and her partner, who has no symptoms, were immediately put in isolation Wednesday and the case reported to Italian maritime authorities. Passengers of the Costa Smeralda were being kept on board Thursday pending checks to determine the type of virus. The ship had sailed from Mallorca, Spain, to Civitavecchia on a weeklong Mediterranean cruise. On the retail front, Swedish furniture and home goods retailer IKEA announced all its stores in mainland China would remain closed to protect its customers and staff from the outbreak. The stores are a favorite haunt of Chinese city dwellers both for shopping and for hanging out. Scandinavian Airlines announced it was halting all its flights to Beijing and Shanghai due to the virus as of Friday until Feb. 9th. SAS, which has 12 regular weekly flights from Scandinavia to China, said Thursday that ""the safety of our passengers and employees is our highest priority."" Spain's Iberia national airline also halted the three return flights a week it runs between Madrid and Shanghai because of the virus. The company said the suspension would start Friday and continue through the month of February. Those announcements followed moves to halt or reduce flights to China by other European airlines, including British Airways, Lufthansa, Austrian Airlines, Swiss, Air France and KLM. Download The Times of India News App for Latest World News."
 Coronavirus outbreak: Rahul Gandhi hopes Chinese find courage to persevere through ordeal | India News - Times of India,"NEW DELHI: As China grapples with the outbreak of coronavirus, Congress leader Rahul Gandhi on Friday hoped that people there find courage and strength to persevere through the ordeal. ""In China, the Coronavirus has killed hundreds of people. My thoughts are with the families of the victims and the millions who have been forced into quarantine to prevent the spread of the virus. May they find the courage and strength to persevere through this terrible ordeal,"" he said on Twitter. In China, the Coronavirus has killed hundreds of people. My thoughts are with the families of the victims & the mil… https://t.co/2y91dvX9SR— Rahul Gandhi (@RahulGandhi) 1580442484000The death toll in China's novel coronavirus outbreak has climbed to 213 with the number of confirmed cases totalling to 9,692. The WHO has declared the novel coronavirus outbreak a global health emergency. Download The Times of India News App for Latest India News."
"Wary of irking China, Trump offers rosy take on virus threat - Times of India","WASHINGTON: President Donald Trump had plenty to talk about during his latest big campaign rally, regaling a friendly crowd in New Jersey with his thoughts about impeachment, the economy, the border wall, local politics and much more. But the president was conspicuously quiet about one big issue that has much of the globe on pins and needles: the spread of a deadly new type of coronavirus. A self-described germaphobe, Trump has had little to say in public about the new virus that so far has killed more than 170 people in China, sickened thousands more there and led to a handful of confirmed cases in the U.S. And he speaks in broad terms when he does talk about it. ""We're very much involved with them, right now, on the virus that's going around,'' Trump said of China before signing a trade deal at the White House on Wednesday. He said he had discussed the situation with Chinese President Xi Jinping and added, ""We're working very closely with China.'' Aides and confidants say Trump's careful approach is part of a political strategy crafted to avoid upsetting the stock market or angering China by calling too much attention to the virus or blaming Beijing for not managing the situation better, according to a White House official and a Republican close to the White House. They spoke on condition of anonymity because they were not authorized to discuss private conversations. Later Wednesday, Trump tweeted out photos from a briefing on the virus he attended with administration officials in the Situation Room, writing that ""we have the best experts anywhere in the world and they are on top of it 24/7!'' Just received a briefing on the Coronavirus in China from all of our GREAT agencies, who are also working closely w… https://t.co/3JD0tWoy2a— Donald J. Trump (@realDonaldTrump) 1580342812000In keeping with the low-profile approach, the White House announced by email Wednesday night that the meeting included members of a task force that will lead the US response to the new virus. The 12-person team is chaired by Secretary of Health and Human Services Alex Azar and coordinated through the National Security Council. The president's comments contrast sharply with the fierce criticism he lobbed at his predecessor, President Barack Obama, during the 2014-15 Ebola crisis, which left more than 11,000 dead in three West African nations. At the time, Trump ripped into Obama as a ""dope"" and ""incompetent"" and called for a travel ban on visitors from Ebola-infected countries. Trump also advocated preventing infected American health care workers from coming home for treatment. Obama faced some criticism from public health officials for being slow to address the Ebola crisis initially, but also received plaudits for eventually attacking it with vigor. He nudged Congress to make a $5.4 billion emergency appropriation to aid the fight and sent 3,000 US troops to West Africa to help with the international response. Lawrence Gostin, a professor of global health law at Georgetown University, said he's taken a measure of comfort in the fact that Trump, so far, hasn't overreacted and has resisted ""fanning the flames'' as he did with his rhetoric during the Ebola crisis. That leaves room, Gostin said, for public health professionals to take the lead. ""As long as that continues and as long as there isn't political interference or mass quarantines in the US or outright travel bans, I will feel comfortable with how the White House is handling it,'' Gostin said. He added that he'd like to see Trump ask Congress for a $1 billion emergency appropriation to help agencies battling to contain the virus. Trump is well aware the virus outbreak in China could create a wild card for the US economy during an election year. And he has long prioritized the US economic relationship with China, especially during trade negotiations, and similarly largely held his tongue during widespread protests in Hong Kong. He also takes enormous pride in the personal relationship he's developed with Xi and has commended him for demonstrating ""transparency"" as he deals with the crisis. Trump said, ""we have it totally under control'' when he was asked about the new type of coronavirus while in Switzerland last week to attend an economic conference. And in a separate Twitter posting, he offered reassurance but scant detail for his confidence. ""China has been working very hard to contain the Coronavirus,"" Trump tweeted. ""The United States greatly appreciates their efforts and transparency. It will all work out well."" But some public health experts say Trump's rosy assessments of the situation don't match the ground truth. Gostin pointed to Chinese government bureaucratic delays that led to tens of thousands of people traveling outside of Wuhan province, increasing the likelihood that the virus will travel far beyond China. ""It's not accurate at all,'' Gostin said of Trump's assessment of China's handling of the outbreak. ""China manifestly does not have this under control."" Trump's budgets have proposed cuts to public health, only to be overruled by Congress, where there's strong bipartisan support for agencies like the Centers for Disease Control and Prevention. Indeed, the money government disease detectives are tapping to fight the latest outbreak was a congressional idea. The Department of Health and Human Services has accessed a $105 million fund lawmakers created to counter emerging threats from infectious diseases. That helps scientists to immediately deploy to help contain the outbreak, work on devising treatments for the virus, and investigate potential vaccines. Rep. Tom Cole, R-Okla., an original sponsor of the idea, said the rapid response fund has proven its worth twice since it was set up in 2017. It was also tapped to help confront the most recent Ebola virus outbreak in Africa. Trump's Democratic presidential rivals have zeroed in on the president's efforts to reduce financing for public health organizations. Former Vice President Joe Biden and others have criticized Trump for eliminating a senior director position for global health security and biothreats at the National Security Council earlier in his term. Trump has also repeatedly sought budget cuts to the CDC and the National Institutes for Health. Congress resisted that, and the 2020 budget includes $8 billion for the CDC, $1.4 billion more than Trump's budget request. It also includes $41.7 billion for the NIH, $7.5 billion more than Trump's budget request. Biden wrote in an opinion article for USA Today this week that the ""possibility of a pandemic is a challenge Donald Trump is unqualified to handle as president."" Massachusetts Sen. Elizabeth Warren, another Democratic contender for the 2020 nomination, tweeted that after the Ebola outbreak, Congress ""invested to prevent pandemics like coronavirus. Donald Trump tried to cut that funding."" Download The Times of India News App for Latest World News."
Ghaziabad: Virus fear after woman returns from China | Ghaziabad News - Times of India,"GHAZIABAD: The health department on Thursday rushed a quick response team to a flat in Vasundhara after it received a message from the Airports Authority of India that a 27-year-old city resident had landed in Delhi from China. By the time they reached her house, she had left for Delhi. CMO NK Gupta said she was studying in China and returned home on Wednesday. “In view of Wuhan coronavirus scare, we have orders that anyone coming from China should be screened and kept in isolation,” he said. Meanwhile, all three patients quarantined in Delhi’s RML hospital have tested negative. TNN Download The Times of India News App for Latest City News."
 India prepares to evacuate its citizens from virus-hit Wuhan on Friday | India News - Times of India,"BEIJING: India was preparing to evacuate its citizens on Friday from China's Wuhan city, the epicentre of the deadly choronavirus that has killed 170 people, infected 7,711 others and spread to at least 17 countries. India had requested China for permission to operate two flights to bring back its nationals from worst-affected central Hubei province. ""We are preparing for air evacuation from Wuhan tomorrow in the evening,"" Indian Embassy in Beijing said. The first flight will carry those Indian nationals who are in and around Wuhan and have conveyed consent for their evacuation, it said. ""There will be another flight subsequently which will carry those who are from other parts of Hubei province,"" the mission said. The nationwide death toll from novel coronavirus has jumped to 170 with 38 more fatalities reported mainly from Hubei province, the government said on Thursday, while confirming more than 1,700 new infections. China's National Health Commission said on Thursday that 7,711 confirmed cases of pneumonia caused by the novel coronavirus had been reported in 31 provincial-level regions and in the Xinjiang Production and Construction Corps by the end of Wednesday. Download The Times of India News App for Latest India News."
Odisha advises home isolation for two men who visited China recently | Bhubaneswar News - Times of India,"Bhubaneswar: The state has advised ‘home isolation’ for two men who arrived here on a flight from Malaysia on Wednesday evening as a precautionary measure against the spread of novel coronavirus (n-CoV). Health officials said both had recently travelled to China. The health department has kept the identities of the men confidential. “The two have no symptoms of any illness. They, however, have declared that they had been to China recently. Hence, they have been advised to stay in isolation in their homes,” health secretary Nikunja Bihari Dhal said. Dhal said the government would monitor their health for the following 15 days. “Our teams will check on them daily. If they develop symptoms, their blood samples will be taken,” he added. The director of public health (DPH), Ajit Kumar Mohanty, said persons advised home isolation should not share a bed and utensils with others in the family. “There is no cause for panic. Good personal hygiene remains the most important strategy to prevent the possible spread of n-CoV,” he said. As per an advisory of the Union health ministry, those who have travelled to China recently (in January) are to be monitored and their blood samples tested in case they develop any symptoms such as a runny nose, high fever and cough. Blood samples of those who have travelled to Wuhan in the past month has to be tested even if they show no symptoms. All samples in the state will be collected by the Regional Medical Research Centre, an institution that functions under the Indian Council of Medical Research, and sent to the National Institute of Virology, Pune, for testing. Download The Times of India News App for Latest City News."
"Home after 7-day isolation for novel coronavirus, Kalyan man relieved | Mumbai News - Times of India","MUMBAI: Away from family, friends and besieged by information about a raging new virus, this Kalyan man (36) spent this past week in isolation at Kasturba Hospital, Chinchpokli, for suspected novel coronavirus (nCoV). Speaking to TOI following his discharge on Thursday, the father of two said he was relieved to have not carried the infection home. The sales executive and his 31-year-old female colleague from Nalasopara, who had both travelled to China for work, were the first from the city to be isolated at Kasturba on January 23. He had volunteered to meet local doctors after his cold and cough persisted for 24 hours on his return from China’s Guangzhou where he spent six days. “There were moments of euphoria, panic and frustration in the last seven days (of quarantine). The fact that little is known about the virus and how to treat it scared us. We were constantly reading about cases and deaths in China on our phones. When the first report came negative, I was filled with relief and excitement,” he said, adding that staying in touch with loved ones helped him cope with the isolation. The authorities then decided to carry out the second round of tests. “However, they refused to discharge us even after the second test reports arrived on January 28... We got frustrated and anxious.” The Kalyan man recalled that everything was normal when they landed in China on January 16. “By the time we returned, though, things had changed. The Wuhan outbreak had become big. The airport was teeming with people in masks,” he said. “The temperature there was 10 degrees and I had a cold” He said nurses checked on them at least three times a day donning protective gear. “Quality of food was alright but there is room for improvement in cleaning of dishes. The rooms were cleaned multiple times in a day,” he said. “I would urge all with symptoms to seek medical advice.” Download The Times of India News App for Latest City News."
"Gujarat: ‘43 China arrivals screened, coronavirus not detected’ | Ahmedabad News - Times of India","GANDHINAGAR/ AHMEDABAD: After the first confirmed coronavirus case in India was reported from Kerala on Thursday, the state health department said that its screening of arrivals from China had been strengthened. Jai Prakash Shivahare, state health commissioner, said that 43 such recent arrivals had all have been screened. “They are all healthy. They are under medical observation at their homes as a precaution,” said Shivahare. “Citizens need not panic as the coronavirus has been reported in 17 countries but so far there has been no case in Gujarat. The state administration is fully prepared for any scenario.” He said arrivals from China, Hong Kong, Singapore, Thailand, Japan and South Korea are being screened according to government of India guidelines. Of the 43 screened, 16 were from Mehsana, six from Panchmahal, three from Anand, five from Surat, four from Ahmedabad, two each from Junagadh and Vadodara, and one each from Ahmedabad district, Mahisagar, Patan, Jamnagar and Rajkot. Shivahare added that at the Ahmedabad international airport Terminal II, round-the-clock screening has been initiated and there are doctors and paramedical staff stationed at the spot. “The medical team has thermal scanners, PPE kit, N-95 masks, three-layer masks, oxygen, emergency medicine and self-declaration forms,” he said. Health department officials said all those returning from China are requested to approach the screening desk not only for their own well-being but also for the health of their families. Apart from the Ahmedabad airport, airports at Vadodara, Surat and Rajkot have health alerts displaying coronavirus symptoms and requesting passengers to get screened if they experience any of the symptoms and have visited China recently. Officials at the Ahmedabad Civil Hospital said the hospital is the nodal centre and will serve as a base hospital. “Staffers from more than 100 government hospitals and medical colleges in the state have been trained on coronavirus and more will be trained this week. Isolation wards have been readied at major hospitals,” said a senior hospital official. Download The Times of India News App for Latest City News."
Coronavirus outbreak: Three advised home quarantine in Vadodara | Vadodara News - Times of India,"VADODARA: Three persons turned up at the SSG Hospital (SSG) on Thursday morning to get themselves tested as they had just returned from China. They did not show any symptoms hinting at a possible coronavirus infection and were advised home quarantine. The hospital authorities were in for a surprise as three persons came in quick succession to get themselves examined. The three had visited China for official work and had landed at the Vadodara airport. From there, they went directly to SSGH for examination. SSGH sources said that the three patients’ history was recorded in detail and they were examined. Since none of them had any symptoms like the coronavirus infection, they were allowed to go with instructions regarding the precautions they have to take. The instructions included staying in home quarantine. Two of the three persons who had approached the SSG had gone for an official assignment for the company they worked for. “Due to the viral outbreak, the company asked us to return safely. We did not have any symptoms,” said one of two persons who came to the city via Mumbai. Download The Times of India News App for Latest City News."
Cops to be roped in to spot Chinese tourists | Jaipur News - Times of India,"Jaipur: Amid scare of coronavirus, all hotels of the city and other parts of the state will be searched for people who have reached from China for keeping a watch on their health. For the purpose, the health department has decided to engage the police department. The police will help the health department in identifying tourists from China who are staying in hotels, guest houses and also at residences. The health department is not taking any chance in its efforts to keep monitoring the health of the people who came from China which has reported an outbreak of coronavirus. Two persons who have returned from China have already been quarantined at Sawai Man Singh Hospital after being suspected to have coronavirus. Their samples have already been sent to National Institute of Virology, Pune. Additional chief secretary (health) Rohit Kumar Singh said, “We gave appealed to the people who have reached here in Rajasthan from China after January 15 to remain indoor to stay at their homes for at least 14 days and also to get screened for coronavirus. We have appealed them not to come in contact with other people.” Moreover, the health department is taking measure to start the diagnostic facilities for coronavirus in the state soon. As of now, no hospital in the state has the facility to conduct diagnostic test of coronavirus and in the absence of that the health department has to send the samples to National Institute of Virology, Pune. For the convenience of people, the health department has issued helpline numbers 01123978046 and 01412225624 and toll free number 104 and 108 to get information regarding coronavirus. Download The Times of India News App for Latest City News."
